{"componentChunkName":"component---src-templates-mdx-post-js","path":"/posts/the-war-on-pathogens","webpackCompilationHash":"666caffc9b104caba1a6","result":{"data":{"mdx":{"id":"2746cdb8-cbab-540f-929e-d6dabbdeb897","body":"function _extends() { _extends = Object.assign || function (target) { for (var i = 1; i < arguments.length; i++) { var source = arguments[i]; for (var key in source) { if (Object.prototype.hasOwnProperty.call(source, key)) { target[key] = source[key]; } } } return target; }; return _extends.apply(this, arguments); }\n\nfunction _objectWithoutProperties(source, excluded) { if (source == null) return {}; var target = _objectWithoutPropertiesLoose(source, excluded); var key, i; if (Object.getOwnPropertySymbols) { var sourceSymbolKeys = Object.getOwnPropertySymbols(source); for (i = 0; i < sourceSymbolKeys.length; i++) { key = sourceSymbolKeys[i]; if (excluded.indexOf(key) >= 0) continue; if (!Object.prototype.propertyIsEnumerable.call(source, key)) continue; target[key] = source[key]; } } return target; }\n\nfunction _objectWithoutPropertiesLoose(source, excluded) { if (source == null) return {}; var target = {}; var sourceKeys = Object.keys(source); var key, i; for (i = 0; i < sourceKeys.length; i++) { key = sourceKeys[i]; if (excluded.indexOf(key) >= 0) continue; target[key] = source[key]; } return target; }\n\n/* @jsx mdx */\nvar _frontmatter = {\n  \"path\": \"/posts/the-war-on-pathogens\",\n  \"date\": \"2020-10-21T23:19:51.246Z\",\n  \"title\": \"The War On Pathogens\",\n  \"author\": \"Max Fowler\",\n  \"type\": \"blog\",\n  \"image\": \"/content/blog/the-war-on-pathogens/img/covid-risk.png\",\n  \"description\": \"a collection of resources considering the ways in which corona restrictions may be causing more harm than corona in the long-term, organized into sections\",\n  \"note\": \"Max Fowler\"\n};\nvar layoutProps = {\n  _frontmatter: _frontmatter\n};\nvar MDXLayout = \"wrapper\";\nreturn function MDXContent(_ref) {\n  var components = _ref.components,\n      props = _objectWithoutProperties(_ref, [\"components\"]);\n\n  return mdx(MDXLayout, _extends({}, layoutProps, props, {\n    components: components,\n    mdxType: \"MDXLayout\"\n  }), mdx(\"p\", null, \"This is a collection of resources considering the ways in which corona restrictions may be causing more harm than corona in the long-term,\\norganized into sections.\"), mdx(\"p\", null, \"It includes arguments from epidemiologists at the top,\\nand from less accredited sources at the bottom along with an exploration of the role of conspiracy theories as myths,\\na blue line denotes the separation.\"), mdx(\"p\", null, \"It can both be true that deaths from disease are heartbreaking and that extreme reaction to disease does more harm than good. Media polarization and sensationalism accelerates discussions into binaries, which has led to simplistic models and fear-based reactions,\\na continuation of previous media and cultural trends.\"), mdx(\"p\", null, \"As much as we can imagine that its better to be safe than sorry,\\nthis sentiment can apply equally to the harms from Corona as to harms from the unprecedented lockdown.\\nI hope these resources can be an offering towards more holistic perspectives on public health wherever that leads.\"), mdx(\"br\", null), mdx(\"br\", null), mdx(\"b\", {\n    className: \"section-header\"\n  }, \"Sunetra Gupta\"), mdx(\"p\", null, \"If you read one thing, I recommend to read this interview, which gets at many of the epidemiological and social issues:\"), mdx(\"p\", null, mdx(\"a\", _extends({\n    parentName: \"p\"\n  }, {\n    \"href\": \"https://reaction.life/we-may-already-have-herd-immunity-an-interview-with-professor-sunetra-gupta/?fbclid=IwAR0ucQOKcLEDQNapy0RRFx3TQQ_VhiCANyFWZAzmRoUfHVp8BpablTZxceE\"\n  }), \"An Interview  With Sunetra Gupta\")), mdx(\"div\", {\n    className: \"description\"\n  }, mdx(\"p\", null, \"Sunetra Gupta is an Indian infectious disease epidemiologist and a professor of theoretical epidemiology at the Department of Zoology, University of Oxford.\\nShe has performed research on the transmission dynamics of various infectious diseases, including malaria, influenza and COVID-19,\\nand has received the Scientific Medal of the Zoological Society of London and the Rosalind Franklin Award of the Royal Society.\"), mdx(\"p\", null, \"Hearing her perspective, it should at the very least be seen that the debate around public health and Covid-19 is not as simple\\nas scientifically literate and illiterate.\")), mdx(\"br\", null), mdx(\"br\", null), mdx(\"b\", {\n    className: \"section-header\"\n  }, \"The Great Barrington Declaration\"), mdx(\"p\", null, \"On October 5th, Dr. Gupta, Dr. Kulldorff and Dr. Bhattacharya jointly published The Great Barrington Declaration,\\nwhich outlines some pieces of the issue in short form:\\n\", mdx(\"a\", _extends({\n    parentName: \"p\"\n  }, {\n    \"href\": \"https://gbdeclaration.org/\"\n  }), \"https://gbdeclaration.org/\")), mdx(\"p\", null, \"More from Kulldorff:\", mdx(\"br\", null), \"\\n\", mdx(\"a\", _extends({\n    parentName: \"p\"\n  }, {\n    \"href\": \"https://www.spiked-online.com/2020/10/09/lockdown-is-a-terrible-experiment/\"\n  }), \"Lockdown is a terrible experiment\"), mdx(\"br\", null), \"\\n\", mdx(\"a\", _extends({\n    parentName: \"p\"\n  }, {\n    \"href\": \"https://www.spectator.co.uk/article/herd-immunity-is-still-key-in-the-fight-against-covid-19\"\n  }), \"Herd immunity is still the key in the fight against Covid-19\")), mdx(\"p\", null, \"Kulldorff points to the ways that even just from the harms from Covid alone,\\ngeneral lockdown may be doing more harm than good, and the burden of lockdown is not shared equally between rich and poor.\"), mdx(\"br\", null), mdx(\"br\", null), mdx(\"b\", {\n    className: \"section-header\"\n  }, \"Infection Fatality Rate\"), mdx(\"p\", null, \"This often-cited statistic carries a great deal of heterogeneity by time, place, population and definition.\\nThis \", mdx(\"a\", _extends({\n    parentName: \"p\"\n  }, {\n    \"href\": \"https://www.who.int/bulletin/online_first/BLT.20.265892.pdf\"\n  }), \"meta-study\"), \", published on October 14th, 2020,\\nfrom the WHO website, looked at 61 studies around the world, and found that the\\nCovid IFR for people under 70 ranges from 0.00% to 0.31% with a crude corrected median of 0.05%, and a general population\\nmedian infection fatality rate of 0.27%.\"), mdx(\"p\", null, \"However, for a number of reasons, I don't think infection fatality rate is actually the best statistic for thinking about risk.\"), mdx(\"p\", null, \"This \", mdx(\"a\", _extends({\n    parentName: \"p\"\n  }, {\n    \"href\": \"https://medium.com/wintoncentre/how-much-normal-risk-does-covid-represent-4539118e1196\"\n  }), \"article\"), \" looks at the risk from Corona in terms of equivalent risk from normal life at your age. It found that\\nwhatever age you are, the risk of dying after getting Corona was roughly equivalent\\nto the natural risk of dying without corona in the next year at that age.\"), mdx(\"figure\", {\n    style: {\n      \"marginTop\": \"0px\"\n    }\n  }, mdx(\"img\", {\n    src: \"/content/blog/the-war-on-pathogens/img/covid-risk.png\",\n    className: \"figureImage\",\n    style: {}\n  }), mdx(\"figcaption\", null, \"The mortality risk with COVID-19 superimposed on background annual risk, from \", mdx(\"a\", {\n    className: \"caption-link\",\n    href: \"https://medium.com/wintoncentre/how-much-normal-risk-does-covid-represent-4539118e1196\"\n  }, \"\\\"How much 'normal' risk does Covid represent?\\\"\"))), mdx(\"p\", null, \"Other estimates, such as by nobel-laureate Michael Levitt, have placed the equivalent risk at \", mdx(\"a\", _extends({\n    parentName: \"p\"\n  }, {\n    \"href\": \"https://medium.com/@michael.levitt/the-excess-burden-of-death-from-coronavirus-covid-19-is-closer-to-a-month-than-to-a-year-83fca74455b4\"\n  }), \"one month of normal life\"), \".\\nI speculate the true number is somewhere in between and would like to see this graph reproduced using more recent data.\"), mdx(\"p\", null, \"Whatever the exact risk is, to me this way of looking at risk contextualizes it in a way\\nwhich feels more relevant than other metrics.\"), mdx(\"br\", null), mdx(\"br\", null), mdx(\"b\", {\n    className: \"section-header\"\n  }, \"Harms From Lockdown\"), mdx(\"p\", null, \"The harms from lockdown are various and many may never be fully quantified or even known. Some are very direct, like\\nthe \", mdx(\"a\", _extends({\n    parentName: \"p\"\n  }, {\n    \"href\": \"https://medicalxpress.com/news/2020-09-covid-annual-tb-deaths.html\"\n  }), \"525,000 additional people projected to die in 2021\"), \" from tuberculosis because of decreased access to care.\\nOther effects are more insidious \", \"\\u2014\", \" what are the long-term effects on children being taught to fear other children and physical closeness?\"), mdx(\"p\", null, \"Here are some of the effects already being seen,\"), mdx(\"ul\", null, mdx(\"li\", {\n    parentName: \"ul\"\n  }, mdx(\"a\", _extends({\n    parentName: \"li\"\n  }, {\n    \"href\": \"https://medicalxpress.com/news/2020-09-covid-annual-tb-deaths.html\"\n  }), \"COVID-19 may add 525,000 to annual TB deaths\")), mdx(\"li\", {\n    parentName: \"ul\"\n  }, mdx(\"a\", _extends({\n    parentName: \"li\"\n  }, {\n    \"href\": \"https://www.nytimes.com/2020/09/30/world/the-pandemics-financial-pain-is-worst-for-black-and-latino-parents-a-survey-finds.html\"\n  }), \"The pandemic\\u2019s financial pain is worst for Black and Latino parents, a survey finds\")), mdx(\"li\", {\n    parentName: \"ul\"\n  }, mdx(\"a\", _extends({\n    parentName: \"li\"\n  }, {\n    \"href\": \"https://oxfamilibrary.openrepository.com/bitstream/handle/10546/621023/mb-the-hunger-virus-090720-en.pdf\"\n  }), \"The Hunger Virus: How Covid-19 Is Fuelling Hunger In A Hungry World\")), mdx(\"li\", {\n    parentName: \"ul\"\n  }, mdx(\"a\", _extends({\n    parentName: \"li\"\n  }, {\n    \"href\": \"https://www.forbes.com/sites/jackieabramian/2020/07/22/the-covid-19-pandemic-has-escalated-global-domestic-violence/#7b9ca1c5173e\"\n  }), \"The Covid-19 Pandemic Has Escalated Domestic Violence Worldwide\")), mdx(\"li\", {\n    parentName: \"ul\"\n  }, mdx(\"a\", _extends({\n    parentName: \"li\"\n  }, {\n    \"href\": \"https://www.cdc.gov/mmwr/volumes/69/wr/mm6932a1.htm\"\n  }), \"During June 24\\u201330, 2020, U.S. adults reported considerably elevated adverse mental health conditions associated with COVID-19. Younger adults, racial/ethnic minorities, essential workers, and unpaid adult caregivers reported having experienced disproportionately worse mental health outcomes, increased substance use, and elevated suicidal ideation.\")), mdx(\"li\", {\n    parentName: \"ul\"\n  }, mdx(\"a\", _extends({\n    parentName: \"li\"\n  }, {\n    \"href\": \"https://apnews.com/article/virus-outbreak-health-middle-east-africa-united-nations-619efb65b9eeec5650f011b960a152e9\"\n  }), \"New Polio outbreak in Sudan from suspended vaccination campaigns\")), mdx(\"li\", {\n    parentName: \"ul\"\n  }, mdx(\"a\", _extends({\n    parentName: \"li\"\n  }, {\n    \"href\": \"https://academic.oup.com/jlb/advance-article/doi/10.1093/jlb/lsaa064/5912724\"\n  }), \"COVID-19 emergency measures and the impending authoritarian pandemic\")), mdx(\"li\", {\n    parentName: \"ul\"\n  }, mdx(\"a\", _extends({\n    parentName: \"li\"\n  }, {\n    \"href\": \"https://www.economist.com/international/2020/06/22/covid-19-has-led-to-a-pandemic-of-plastic-pollution\"\n  }), \"Covid-19 has led to a pandemic of plastic pollution\"))), mdx(\"p\", null, \"This is just a sample, but the scale and diversity of impacts suggest this a pointer to the iceberg.\"), mdx(\"br\", null), mdx(\"br\", null), mdx(\"b\", {\n    className: \"section-header\"\n  }, \"Cases, Testing & Media Coverage\"), mdx(\"p\", null, \"It would probably be a whole other book to look specifically at how the state of the media is effecting\\nthe cultural and scientific discourse.\"), mdx(\"p\", null, \"One small piece of this is reporting corona cases on a daily basis.\\nThe graph below, from \", mdx(\"a\", _extends({\n    parentName: \"p\"\n  }, {\n    \"href\": \"https://ourworldindata.org/grapher/daily-covid-cases-deaths?time=2020-01-01..latest\"\n  }), \"Our World In Data\"), \", shows the disconnection between global number of cases and deaths.\"), mdx(\"figure\", null, mdx(\"img\", {\n    src: \"/content/blog/the-war-on-pathogens/img/cases-and-deaths.png\",\n    className: \"figureImage\",\n    style: {}\n  }), mdx(\"figcaption\", null, \"Cases plotted against deaths worldwide, from \", mdx(\"a\", {\n    className: \"caption-link\",\n    href: \"https://ourworldindata.org/grapher/daily-covid-cases-deaths?time=2020-01-01..latest\"\n  }, \"Our World In Data\"))), mdx(\"p\", null, \"Other sources also point to this, even including the \", mdx(\"a\", _extends({\n    parentName: \"p\"\n  }, {\n    \"href\": \"https://www.nytimes.com/live/2020/10/20/world/covid-19-coronavirus-updates#a-third-surge-of-coronavirus-infections-has-now-firmly-taken-hold-across-much-of-the-united-states\"\n  }), \"New York Times\"), \",\\nbut reporting based on cases continues to center fear.\"), mdx(\"p\", null, \"Fear-based reporting is perhaps best exemplified by the trend of reporting the number of Corona deaths in terms of multiples of 9/11,\\nan event which was itself perhaps the most politicized and utilized-to-incite-fear event in recent history, hardly a sane reference point.\"), mdx(\"br\", null), mdx(\"br\", null), mdx(\"b\", {\n    className: \"section-header\"\n  }, \"Security Theatre\"), mdx(\"p\", null, \"Next to the harms caused by lockdown, it becomes clear that at the very least, it is not the case that\\nall efforts to prevent the spread of Corona are beneficial and moral, regardless of their efficacy.\"), mdx(\"p\", null, \"If we acknowledge that the strategy/ideology of restrictions have costs, then we can at least aim\\nthat preventative measures are informed by efficacy. In reality, many preventative measures are informed\\nby public perception of liablity, moralizing and germophobia, with varying levels of alignment with actual efficacy.\"), mdx(\"p\", null, \"Some examples,\"), mdx(\"ul\", null, mdx(\"li\", {\n    parentName: \"ul\"\n  }, mdx(\"a\", _extends({\n    parentName: \"li\"\n  }, {\n    \"href\": \"https://www.theatlantic.com/ideas/archive/2020/10/schools-arent-superspreaders/616669/\"\n  }), \"Schools Aren\\u2019t Super-Spreaders, Fears from the summer appear to have been overblown\")), mdx(\"li\", {\n    parentName: \"ul\"\n  }, mdx(\"a\", _extends({\n    parentName: \"li\"\n  }, {\n    \"href\": \"https://medicalxpress.com/news/2020-09-covid-infections-respiratory-droplets-aerosols.html?fbclid=IwAR0daSP2vCyfUlxxVtS6SGB9RVCeNPHgoxBPWoIZbUWjK0p6n9LaiPp-lyY\"\n  }), \"Corona is not easily transmitted through surfaces\"), \", yet 'deep cleaning' helps people feel more at ease (\", mdx(\"a\", _extends({\n    parentName: \"li\"\n  }, {\n    \"href\": \"https://www.dailymail.co.uk/news/article-8291771/New-York-subway-closes-time-workers-perform-deep-clean-Covid-19-lockdown.html\"\n  }), \"e.g. deep-cleaning new york subway\"), \")\")), mdx(\"p\", null, \"Tracking hospital bed capacity (the original motivation for the initial lockdown) makes sense,\\nas well as building more hospital capacity, but general lockdown disconnected from hospital capacity increases harm.\"), mdx(\"br\", null), mdx(\"br\", null), mdx(\"b\", {\n    className: \"section-header\"\n  }, \"Long Covid\"), mdx(\"p\", null, \"While Long Covid is a real concern (my mom experienced a form of it, having symptoms for 4 weeks after getting Covid),\\nnext to the harms of lockdown, justifying lockdown in terms of long covid seems like a sort of shifting ground argument\\nand hard to universalize.\"), mdx(\"p\", null, \"For people who work on the computer, have stable home situations and are less effected by restrictions,\\nthey will see the tradeoffs differently.\"), mdx(\"p\", null, \"Ultimately our assessment of risks will involve many different factors. My feeling is not that Covid isn't real,\\nbut that a number of societal biases have effected the way that it is understood.\"), mdx(\"br\", null), mdx(\"br\", null), mdx(\"b\", {\n    className: \"section-header\"\n  }, \"Root Causes\"), mdx(\"p\", null, \"The societal bias that lockdown is good for public health is an outgrowth from the colonial perspective that humans are separate from nature\\nand that the human body is a pure sterile space (ignoring the microbiome and that humans actually have an ecological relationship with viruses and bacteria).\\nThis bias continues capitalist trends towards alienation from nature, each other, and our bodies, and furthers the deterioration of our health,\\nwhich truly was already in a public health crisis long before corona (from pesticides, pollution, climate change, capital-influenced healthcare, the opioid crisis, biodiversity loss, lack of access to nature, and other factors).\"), mdx(\"p\", null, \"Perhaps if we could have had a perfect lockdown in March we could have prevented\\nthe spread of the virus entirely. But given that didn't happen, it seems likely Covid will become endemic like other coronaviruses. There are many other new normals one could imagine instead of \\\"the war on pathogens\\\",\\neven if that would be the most profitable for pharmaceutical companies.\"), mdx(\"p\", null, \"Recently I dislike the way that most writing online ends.\\nAs though everything needs to be tied into a bow for jury submission.\\nGiven that I see polarization as part of the problem,\\nI wasn't sure how to write about this in a way that doesn't further contribute to that cycle.\\nSeparate from the framework of thesis-counterthesis,\\nI hope some pieces of this might be a source of grounding, information or perspective.\\nThe next sections are about conspiracy theories as a form of myth.\"), mdx(\"div\", {\n    className: \"blue-line-break\"\n  }), mdx(\"br\", null), mdx(\"br\", null), mdx(\"br\", null), mdx(\"br\", null), mdx(\"b\", {\n    className: \"section-header\"\n  }, \"Origin Of The Term 'Conspiracy Theory'\"), mdx(\"br\", null), mdx(\"br\", null), \"While 'Conspiracy Theory' is often used as a term to dismiss an argument, its worthwhile to recognize the history of the term.\", mdx(\"br\", null), mdx(\"p\", null, \"For a nuanced discussion of the history and role of conspiracy theories, which acknowledges that they\\ncan both contain truths and also mislead, I recommend this podcast:\", mdx(\"br\", null), \"\\n\", mdx(\"a\", _extends({\n    parentName: \"p\"\n  }, {\n    \"href\": \"https://novaramedia.com/2020/08/13/microdose-erik-davis-on-the-cosmic-right/\"\n  }), \"Microdose: Erik Davis on the Cosmic Right\")), mdx(\"p\", null, \"I also appreciate Carl Jung's notion that even when not literally true, conspiracy theories often have some\\nseed of truth to them, and can be interpreted through a form of dream interpretation.\"), mdx(\"p\", null, \"For example, if we look at the Chem Trails conspiracy theory, that the smoke trails seen behind planes\\nare trails of poisonous chemicals released into the air by the government to mind control the population\\nand control the weather \", \"\\u2014\", \" I don't literally believe this conspiracy theory,\\nbut given the connection between air travel and climate change,\\nthere is a sense in which the conspiracy theory is more true than the person who says the jet trails are harmless.\"), mdx(\"p\", null, \"As a further note, I actually can't remember where I read about this Jung theory of conspiracy theories,\\nand its possible that I  made it up, or that perhaps I dreamed about it. If anyone knows a source for this,\\nplease send it to me, as I think about it often.\"), mdx(\"p\", null, \"Given this perspective, I think the idea that conspiracy theories need to be censored or are the cause of\\nproblems in the world, doesn't hold up.\\nI would ask first why someone is in a position where conspiracy theories are the best model\\nfor their lived experience of reality, before trying to silence them.\"), mdx(\"p\", null, \"Beyond that, many conspiracy theories hold truth, and some point to paradigm shifts.\"), mdx(\"p\", null, \"Its an interesting epistemic ground, and perhaps like a Tarot reading, can be either spooky, misleading,\\nhealing or informative, depending on how you engage with it.\"), mdx(\"p\", null, \"With this introduction, here are some less accredited sources on this topic, to be navigated with your own\\ndiscernment to guide you.\"), mdx(\"br\", null), mdx(\"br\", null), mdx(\"b\", {\n    className: \"section-header\"\n  }, \"Banned Accounts And Books\"), mdx(\"p\", null, mdx(\"a\", _extends({\n    parentName: \"p\"\n  }, {\n    \"href\": \"https://swprs.org/facts-about-covid-19/\"\n  }), \"Swiss Policy Research Facts About Covid-19\"), mdx(\"br\", null), \"\\n\", mdx(\"a\", _extends({\n    parentName: \"p\"\n  }, {\n    \"href\": \"https://swprs.org/studies-on-covid-19-lethality/\"\n  }), \"Studies On Covid Lethality\"), mdx(\"br\", null), \"\\nGreenmedinfo (\", mdx(\"a\", _extends({\n    parentName: \"p\"\n  }, {\n    \"href\": \"https://www.instagram.com/greenmedinfo2/\"\n  }), \"instagram\"), \", \", mdx(\"a\", _extends({\n    parentName: \"p\"\n  }, {\n    \"href\": \"https://t.me/sayeregengmi\"\n  }), \"telegram\"), \")\", mdx(\"br\", null), \"\\nAlec Zeck (\", mdx(\"a\", _extends({\n    parentName: \"p\"\n  }, {\n    \"href\": \"https://www.instagram.com/alec.zeck/\"\n  }), \"instagram\"), \", \", mdx(\"a\", _extends({\n    parentName: \"p\"\n  }, {\n    \"href\": \"https://t.me/TheWayFwrd\"\n  }), \"telegram\"), \")\", mdx(\"br\", null), \"\\n\", mdx(\"a\", _extends({\n    parentName: \"p\"\n  }, {\n    \"href\": \"https://www.simonandschuster.com/books/The-Contagion-Myth/Thomas-S-Cowan/9781510764620\"\n  }), \"The Contagion Myth\")), mdx(\"br\", null), mdx(\"br\", null), mdx(\"b\", {\n    className: \"section-header\"\n  }, \"Charles Eisenstein, Conspiracy Theories As Myth\"), mdx(\"p\", null, mdx(\"a\", _extends({\n    parentName: \"p\"\n  }, {\n    \"href\": \"https://charleseisenstein.org/essays/the-conspiracy-myth/\"\n  }), \"The Conspiracy Myth\"), mdx(\"br\", null), \"\\n\", mdx(\"a\", _extends({\n    parentName: \"p\"\n  }, {\n    \"href\": \"https://charleseisenstein.org/essays/the-banquet-of-whiteness/\"\n  }), \"On the racism behind criticism of hydroxychloroquine\"), mdx(\"br\", null), \"\\n\", mdx(\"a\", _extends({\n    parentName: \"p\"\n  }, {\n    \"href\": \"https://charleseisenstein.org/essays/the-coronation/\"\n  }), \"The Coronation\"), mdx(\"br\", null)), mdx(\"p\", null, \"These three pieces by Eisenstein are long but good and really go beyond the surface left vs right, lockdown vs anti-lockdown framework.\"), mdx(\"br\", null), mdx(\"br\", null), mdx(\"b\", {\n    className: \"section-header\"\n  }, \"Epigraph\"), mdx(\"br\", null), mdx(\"br\", null), mdx(\"a\", {\n    className: \"epigraph\",\n    href: \"https://newworldwriting.net/tao-lin-meditation/\"\n  }, \"A Poem By Tao Lin titled \\\"Meditation\\\"\"));\n}\n;\nMDXContent.isMDXComponent = true;","frontmatter":{"date":"October 21, 2020","path":"/posts/the-war-on-pathogens","gumroadPath":null,"title":"The War On Pathogens","description":"a collection of resources considering the ways in which corona restrictions may be causing more harm than corona in the long-term, organized into sections","author":"Max Fowler","image":"/content/blog/the-war-on-pathogens/img/covid-risk.png","images":null,"price":null,"type":"blog"}}},"pageContext":{"isCreatedByStatefulCreatePages":false,"id":"2746cdb8-cbab-540f-929e-d6dabbdeb897"}}}